{
  "archive": {
    "compression": "gzip",
    "duplicate_path_validation": "passed",
    "gid_values": [
      "0"
    ],
    "gname_values": [
      ""
    ],
    "link_inventory": {
      "count": "0",
      "jcs_sha256": "sha256:4f53cda18c2baa0c0354bb5f9a3ecbe5ed12ab4d8e11ba873c2f11161202b945"
    },
    "link_target_validation": "passed",
    "max_regular_file": {
      "bytes": "24625360",
      "path": "go/pkg/tool/darwin_arm64/compile"
    },
    "member_count": "16701",
    "member_inventory": {
      "count": "16701",
      "jcs_sha256": "sha256:5317fd31b65787471be3b270ad73986767edb01063377ac041a98261e4dcdd00"
    },
    "mode_values": [
      "0644",
      "0755"
    ],
    "mtime": {
      "maximum": "1787089461",
      "minimum": "1787089461",
      "unique_count": "1"
    },
    "path_validation": "passed",
    "permission_validation": "passed",
    "special_file_validation": "passed",
    "top_level": "go",
    "total_regular_bytes": "228748173",
    "type_counts": {
      "directory": "1667",
      "file": "15034",
      "hardlink": "0",
      "symlink": "0"
    },
    "uid_values": [
      "0"
    ],
    "uname_values": [
      ""
    ]
  },
  "artifact": {
    "bytes": "64772572",
    "filename": "go1.26.7.darwin-arm64.tar.gz",
    "raw_sha256": "sha256:020a1e8224811be75163e920bc77e0926a1390a6aeea19bdcf23f74b9d749f6d"
  },
  "format": "radishaxiom-toolchain-tar-inspection",
  "format_version": "0.1",
  "inspection_profile": "go1.26.7-darwin-arm64-host",
  "layout_assertions": [
    {
      "expectation": "present",
      "path": "go/LICENSE"
    },
    {
      "expectation": "present",
      "path": "go/PATENTS"
    },
    {
      "expectation": "present",
      "path": "go/VERSION"
    },
    {
      "expectation": "present",
      "path": "go/bin/go"
    },
    {
      "expectation": "present",
      "path": "go/bin/gofmt"
    },
    {
      "expectation": "present",
      "path": "go/pkg/tool/darwin_arm64/compile"
    },
    {
      "expectation": "present",
      "path": "go/pkg/tool/darwin_arm64/link"
    },
    {
      "expectation": "present",
      "path": "go/src/make.bash"
    }
  ],
  "layout_validation": "passed",
  "license_inventory": {
    "count": "36",
    "files": [
      {
        "bytes": "1453",
        "path": "go/LICENSE",
        "raw_sha256": "sha256:911f8f5782931320f5b8d1160a76365b83aea6447ee6c04fa6d5591467db9dad"
      },
      {
        "bytes": "1303",
        "path": "go/PATENTS",
        "raw_sha256": "sha256:96f408bfae65bf137fc2525d3ecb030271c50c1e90799f87abf8846d8dd505cc"
      },
      {
        "bytes": "1453",
        "path": "go/src/cmd/compile/internal/ssa/_gen/vendor/golang.org/x/tools/LICENSE",
        "raw_sha256": "sha256:911f8f5782931320f5b8d1160a76365b83aea6447ee6c04fa6d5591467db9dad"
      },
      {
        "bytes": "1303",
        "path": "go/src/cmd/compile/internal/ssa/_gen/vendor/golang.org/x/tools/PATENTS",
        "raw_sha256": "sha256:96f408bfae65bf137fc2525d3ecb030271c50c1e90799f87abf8846d8dd505cc"
      },
      {
        "bytes": "11358",
        "path": "go/src/cmd/vendor/github.com/google/pprof/LICENSE",
        "raw_sha256": "sha256:cfc7749b96f63bd31c3c42b5c471bf756814053e847c10f3eb003417bc523d30"
      },
      {
        "bytes": "1754",
        "path": "go/src/cmd/vendor/github.com/google/pprof/third_party/svgpan/LICENSE",
        "raw_sha256": "sha256:154c946c17de61ca71d28e13673d76a5798e6e25995a7397fbae157afc8f62b4"
      },
      {
        "bytes": "1479",
        "path": "go/src/cmd/vendor/github.com/ianlancetaylor/demangle/LICENSE",
        "raw_sha256": "sha256:b73277f7730993ef8e7f80aed83e5309762fed4d77eced982abb2c00657c074d"
      },
      {
        "bytes": "1453",
        "path": "go/src/cmd/vendor/golang.org/x/arch/LICENSE",
        "raw_sha256": "sha256:8cda009bd927676a95ee7ce2dae921442ac4d9584d041b56ecfcba6839032f0b"
      },
      {
        "bytes": "1303",
        "path": "go/src/cmd/vendor/golang.org/x/arch/PATENTS",
        "raw_sha256": "sha256:96f408bfae65bf137fc2525d3ecb030271c50c1e90799f87abf8846d8dd505cc"
      },
      {
        "bytes": "1453",
        "path": "go/src/cmd/vendor/golang.org/x/build/LICENSE",
        "raw_sha256": "sha256:911f8f5782931320f5b8d1160a76365b83aea6447ee6c04fa6d5591467db9dad"
      },
      {
        "bytes": "1303",
        "path": "go/src/cmd/vendor/golang.org/x/build/PATENTS",
        "raw_sha256": "sha256:96f408bfae65bf137fc2525d3ecb030271c50c1e90799f87abf8846d8dd505cc"
      },
      {
        "bytes": "1453",
        "path": "go/src/cmd/vendor/golang.org/x/mod/LICENSE",
        "raw_sha256": "sha256:911f8f5782931320f5b8d1160a76365b83aea6447ee6c04fa6d5591467db9dad"
      },
      {
        "bytes": "1303",
        "path": "go/src/cmd/vendor/golang.org/x/mod/PATENTS",
        "raw_sha256": "sha256:96f408bfae65bf137fc2525d3ecb030271c50c1e90799f87abf8846d8dd505cc"
      },
      {
        "bytes": "1453",
        "path": "go/src/cmd/vendor/golang.org/x/sync/LICENSE",
        "raw_sha256": "sha256:911f8f5782931320f5b8d1160a76365b83aea6447ee6c04fa6d5591467db9dad"
      },
      {
        "bytes": "1303",
        "path": "go/src/cmd/vendor/golang.org/x/sync/PATENTS",
        "raw_sha256": "sha256:96f408bfae65bf137fc2525d3ecb030271c50c1e90799f87abf8846d8dd505cc"
      },
      {
        "bytes": "1453",
        "path": "go/src/cmd/vendor/golang.org/x/sys/LICENSE",
        "raw_sha256": "sha256:911f8f5782931320f5b8d1160a76365b83aea6447ee6c04fa6d5591467db9dad"
      },
      {
        "bytes": "1303",
        "path": "go/src/cmd/vendor/golang.org/x/sys/PATENTS",
        "raw_sha256": "sha256:96f408bfae65bf137fc2525d3ecb030271c50c1e90799f87abf8846d8dd505cc"
      },
      {
        "bytes": "1453",
        "path": "go/src/cmd/vendor/golang.org/x/telemetry/LICENSE",
        "raw_sha256": "sha256:911f8f5782931320f5b8d1160a76365b83aea6447ee6c04fa6d5591467db9dad"
      },
      {
        "bytes": "1303",
        "path": "go/src/cmd/vendor/golang.org/x/telemetry/PATENTS",
        "raw_sha256": "sha256:96f408bfae65bf137fc2525d3ecb030271c50c1e90799f87abf8846d8dd505cc"
      },
      {
        "bytes": "1453",
        "path": "go/src/cmd/vendor/golang.org/x/term/LICENSE",
        "raw_sha256": "sha256:911f8f5782931320f5b8d1160a76365b83aea6447ee6c04fa6d5591467db9dad"
      },
      {
        "bytes": "1303",
        "path": "go/src/cmd/vendor/golang.org/x/term/PATENTS",
        "raw_sha256": "sha256:96f408bfae65bf137fc2525d3ecb030271c50c1e90799f87abf8846d8dd505cc"
      },
      {
        "bytes": "1453",
        "path": "go/src/cmd/vendor/golang.org/x/text/LICENSE",
        "raw_sha256": "sha256:911f8f5782931320f5b8d1160a76365b83aea6447ee6c04fa6d5591467db9dad"
      },
      {
        "bytes": "1303",
        "path": "go/src/cmd/vendor/golang.org/x/text/PATENTS",
        "raw_sha256": "sha256:96f408bfae65bf137fc2525d3ecb030271c50c1e90799f87abf8846d8dd505cc"
      },
      {
        "bytes": "1453",
        "path": "go/src/cmd/vendor/golang.org/x/tools/LICENSE",
        "raw_sha256": "sha256:911f8f5782931320f5b8d1160a76365b83aea6447ee6c04fa6d5591467db9dad"
      },
      {
        "bytes": "1303",
        "path": "go/src/cmd/vendor/golang.org/x/tools/PATENTS",
        "raw_sha256": "sha256:96f408bfae65bf137fc2525d3ecb030271c50c1e90799f87abf8846d8dd505cc"
      },
      {
        "bytes": "1479",
        "path": "go/src/cmd/vendor/rsc.io/markdown/LICENSE",
        "raw_sha256": "sha256:2d36597f7117c38b006835ae7f537487207d8ec407aa9d9980794b2030cbc067"
      },
      {
        "bytes": "9714",
        "path": "go/src/crypto/internal/boring/LICENSE",
        "raw_sha256": "sha256:56210f826b8f0fbac3160dfe55c97f4019eb6cdda3963b5a0eab8a8bdb62360e"
      },
      {
        "bytes": "1138",
        "path": "go/src/runtime/testdata/testgoroutineleakprofile/goker/LICENSE",
        "raw_sha256": "sha256:f99df8ae6da6de047ed002d9dbe8682d9a19c88e9a7473abdadf3ac206621a85"
      },
      {
        "bytes": "1453",
        "path": "go/src/vendor/golang.org/x/crypto/LICENSE",
        "raw_sha256": "sha256:911f8f5782931320f5b8d1160a76365b83aea6447ee6c04fa6d5591467db9dad"
      },
      {
        "bytes": "1303",
        "path": "go/src/vendor/golang.org/x/crypto/PATENTS",
        "raw_sha256": "sha256:96f408bfae65bf137fc2525d3ecb030271c50c1e90799f87abf8846d8dd505cc"
      },
      {
        "bytes": "1453",
        "path": "go/src/vendor/golang.org/x/net/LICENSE",
        "raw_sha256": "sha256:911f8f5782931320f5b8d1160a76365b83aea6447ee6c04fa6d5591467db9dad"
      },
      {
        "bytes": "1303",
        "path": "go/src/vendor/golang.org/x/net/PATENTS",
        "raw_sha256": "sha256:96f408bfae65bf137fc2525d3ecb030271c50c1e90799f87abf8846d8dd505cc"
      },
      {
        "bytes": "1453",
        "path": "go/src/vendor/golang.org/x/sys/LICENSE",
        "raw_sha256": "sha256:911f8f5782931320f5b8d1160a76365b83aea6447ee6c04fa6d5591467db9dad"
      },
      {
        "bytes": "1303",
        "path": "go/src/vendor/golang.org/x/sys/PATENTS",
        "raw_sha256": "sha256:96f408bfae65bf137fc2525d3ecb030271c50c1e90799f87abf8846d8dd505cc"
      },
      {
        "bytes": "1453",
        "path": "go/src/vendor/golang.org/x/text/LICENSE",
        "raw_sha256": "sha256:911f8f5782931320f5b8d1160a76365b83aea6447ee6c04fa6d5591467db9dad"
      },
      {
        "bytes": "1303",
        "path": "go/src/vendor/golang.org/x/text/PATENTS",
        "raw_sha256": "sha256:96f408bfae65bf137fc2525d3ecb030271c50c1e90799f87abf8846d8dd505cc"
      }
    ],
    "jcs_sha256": "sha256:2b26f058980c9055b05aba3f2095556640a0702da7cf3dad9cb7521835c8f5cc"
  },
  "required_files": [
    {
      "bytes": "1453",
      "path": "go/LICENSE",
      "raw_sha256": "sha256:911f8f5782931320f5b8d1160a76365b83aea6447ee6c04fa6d5591467db9dad"
    },
    {
      "bytes": "1303",
      "path": "go/PATENTS",
      "raw_sha256": "sha256:96f408bfae65bf137fc2525d3ecb030271c50c1e90799f87abf8846d8dd505cc"
    },
    {
      "bytes": "35",
      "path": "go/VERSION",